### ISSUE TITLE
IO timeout with server fuzzy.rspamd.com

### ISSUE THREAD

**Issue by ashceryth** [rspamd/rspamd#2171]
### Classification (Please choose *one* option):

* [ ] Crash/Hang/Data loss
* [ ] WebUI/Usability
* [ ] Serious bug
* [x] Other bug
* [ ] Feature
* [ ] Enhancement

### Reproducibility (Please choose *one* option):

* [X] Always
* [ ] Sometimes
* [ ] Rarely
* [ ] Unable
* [ ] I didn’t try
* [ ] Not applicable

### Rspamd version:
1.7.3

### Operation system, CPU, memory and environment:
Debian

### Description (Please provide a descriptive summary of the issue):
Log file shows a lot of `fuzzy_check_timer_callback: got IO timeout with server fuzzy.rspamd.com(88.99.142.95), after 3 retransmits` messages.

### Steps to reproduce:
Send a test mail and check the log for `fuzzy_check_timer_callback: got IO timeout with server fuzzy.rspamd.com(88.99.142.95), after 3 retransmits` messages.

### Expected results:
No timeout errors

### Actual results:
Timeout errors

**Comment by tobias-weiss** [comment]
Are you running rspamd behind a firewall and with outgoing traffic restrictions? In that case, make sure outgoing traffic for fuzzy.rspamd.com to port 11335/udp is alloewd. Furthermore I allowed 80/tcp to rep.mailspike.net, zen.spamehouse.org and list.dnswl.org and DNS request to ant destination as I saw rspamd tries to a few.

I do not know, if this list is complete, maybe someone else could comment on this.

**Comment by ashceryth** [comment]
I already checked my logs and can't see anything getting blocked towards 88.99.142.95. So I was wordering if there are maybe issues with the fuzzy service. UDP/11335 is allowed. Strange... So you aren't experiencing any issues with fuzzy service?

**Comment by heraklit256** [comment]
I wasn't even aware that this is UDP...

**Comment by tobias-weiss** [comment]
>  So you aren't experiencing any issues with fuzzy service?

Since I openend the the port 11335/udp in my firewall I did not
expierence any issues, no.

> I wasn't even aware that this is UDP...

I gathered this from my firewall logs. If you test, you will find that
fuzzy.rspamd.com does not accept connections on 11335/tcp.

**Comment by ashceryth** [comment]
Ok, I did a tcpdump on the server running rspamd and I can see that the network communication bewteen my server and fuzzy.rspamd.com is working as expected:

```
10:29:26.761757 IP x.x.x.x.40130 > 88.99.142.95.11335: UDP, length 160
10:29:26.761765 IP x.x.x.x.40130 > 88.99.142.95.11335: UDP, length 160
10:29:26.790627 IP 88.99.142.95.11335 > x.x.x.x.40130: UDP, length 136
```

 This is in the rsapmd.log:

```
2018-04-19 10:29:28 #6223(rspamd_proxy) <a480b9>; proxy; fuzzy_check_timer_callback: got IO timeout with server fuzzy.rspamd.com(88.99.142.95), after 3 retransmits
```

Strange, isn't it?

**Comment by ashceryth** [comment]
Furthermore, where are the 3 retransmits? I can just see one try in the dump, or am I missing something?

**Comment by tobias-weiss** [comment]
> Furthermore, where are the 3 retransmits? I can just see one try in
> the dump, or am I missing something?

Now you mention it, I had the similar experience when I rewieved my
firewall logs. I saw only one attemp to contact fuzzy.rspamd.com in the
logs, not three.

I also had the issue that a spam mail was not blocked. I moved it
immeaditly after receipment on my server to my spam folder to be
learned by rspamc. But rspamdc gave an error, that this messages has
already been learned. So I beginn to doubt if fuzzy works as intended
but I do not see any errors in my logs.

**Comment by ashceryth** [comment]
Trying to resolve the issue I also raised the timeout for fuzzy_check (which defaults to 500ms as far as I interpreted the source code correctly: [rspamd/src/plugins/fuzzy_check.c](https://github.com/vstakhov/rspamd/blob/master/src/plugins/fuzzy_check.c):52) to a few seconds. However, this hasn't helped at all. Any ideas?

**Comment by vstakhov** [comment]
Please do not increase `retransmits` - it makes situation with load even worse. I plan to add fair usage policy for fuzzy storage soon.

So far, there were intermediate issues with fuzzy storage during couple of days. They are now fixed.

**Comment by ashceryth** [comment]
@sokai For me this is like a permanent issue no matter which timeout or retransmit value is set. My log is still full of timeout messages. As you can see from my capture the server is anwering in far less than a second so increasing timeouts doesn't change anything. However, I don't know how to further debug this issue...

**Comment by sokai** [comment]
@vstakhov Thanks for the hints!
@ashceryth I also have no clue … :-|

**Comment by ashceryth** [comment]
I didn't see any timeouts anymore since a while. So this issue is resolved for me.

**Comment by locojohn** [comment]
Are these issues back?

`

12/9/2019, 3:02:51 PM | rspamd_proxy | 1624 | proxy | c07d97 | got IO timeout with server fuzzy1.rspamd.com:11335(88.99.142.95:11335), after 1 retransmits
-- | -- | -- | -- | -- | --
12/9/2019, 2:48:39 PM | rspamd_proxy | 1624 | proxy | a6f91e | got IO timeout with server fuzzy1.rspamd.com:11335(88.99.142.95:11335), after 1 retransmits
12/9/2019, 2:18:42 PM | rspamd_proxy | 1624 | proxy | b9cc0e | got IO timeout with server fuzzy1.rspamd.com:11335(88.99.142.95:11335), after 1 retransmits
12/9/2019, 1:43:59 PM | rspamd_proxy | 1624 | proxy | e65ea7 | got IO timeout with server fuzzy1.rspamd.com:11335(88.99.142.95:11335), after 1 retransmits
12/9/2019, 1:33:06 PM | rspamd_proxy | 1624 | proxy | 9a8e63 | got IO timeout with server fuzzy1.rspamd.com:11335(88.99.142.95:11335), after 1 retransmits
12/9/2019, 1:33:04 PM | rspamd_proxy | 1624 | proxy | b5d645 | got IO timeout with server fuzzy2.rspamd.com:11335(88.99.142.95:11335), after 1 retransmits
12/9/2019, 1:30:33 PM | rspamd_proxy | 1624 | proxy | 307b10 | got IO timeout with server fuzzy1.rspamd.com:11335(88.99.142.95:11335), after 1 retransmits
12/5/2019, 4:02:22 PM | rspamd_proxy | 1624 | proxy | 42c7a5 | got IO timeout with server fuzzy1.rspamd.com:11335(88.99.142.95:11335), after 1 retransmits
12/3/2019, 8:24:09 PM | rspamd_proxy | 1624 | proxy | 6fba5e | got IO timeout with server fuzzy1.rspamd.com:11335(88.99.142.95:11335), after 1 retransmits
12/17/2019, 9:42:54 AM | rspamd_proxy | 1624 | proxy | b9255d | got IO timeout with server fuzzy1.rspamd.com:11335(88.99.142.95:11335), after 1 retransmits

`

**Comment by julian70400** [comment]
Same problem here today : 


04/02/2020 à 15:29:39 | normal | 28960 | task | c44319 | got IO timeout with server fuzzy1.rspamd.com:11335(88.99.142.95:11335), after 1 retransmits
-- | -- | -- | -- | -- | --
04/02/2020 à 15:26:08 | normal | 28960 | task | e35acd | got IO timeout with server fuzzy1.rspamd.com:11335(88.99.142.95:11335), after 1 retransmits
04/02/2020 à 15:26:08 | normal | 28959 | task | b812ea | got IO timeout with server fuzzy2.rspamd.com:11335(88.99.142.95:11335), after 1 retransmits
04/02/2020 à 15:26:06 | normal | 28959 | task | 3d9b22 | got IO timeout with server fuzzy1.rspamd.com:11335(88.99.142.95:11335), after 1 retransmits
04/02/2020 à 15:26:06 | normal | 28960 | task | 527de5 | got IO timeout with server fuzzy2.rspamd.com:11335(88.99.142.95:11335), after 1 retransmits
04/02/2020 à 15:26:02 | normal | 28960 | task | 937daf | got IO timeout with server fuzzy1.rspamd.com:11335(88.99.142.95:11335), after 1 retransmits

**Comment by vstakhov** [comment]
There are no guarantees on this public service.

**Comment by julian70400** [comment]
Damn, next time you will answer me before I post my problem ! ;-)

Ok, so it's not directly related to Rspamd. Anyway, not really a problem, it's just temporary.

**Comment by jimmyparr** [comment]
I don't know if there is a link,
I had a lot of fuzzy i / o time out and retransmits.
so i checked redis-server (systemctl status redis-server).
to find that it was consuming 4.9 G.
So I added /etc/redis/redis.conf

maxmemory 209715200
### 200M ###
maxmemory-policy allkeys-lfu

since this modification I no longer have fuzzy i / o retransmits
I hope I've helped you
