### ISSUE TITLE
[BUG] rspamd sends port numbers in DNS lookups for fuzzy servers sometimes

### ISSUE THREAD

**Issue by WRMSRwasTaken** [rspamd/rspamd#4084]
### Prerequisites

* [x] Put an X between the brackets on this line if you have done all of the following:
    * Read about bug reporting in general: https://rspamd.com/doc/faq.html#how-to-report-bugs-found-in-rspamd
    * Enabled relevant debugging logs: https://rspamd.com/doc/faq.html#how-to-debug-some-module-in-rspamd 
    * Checked the FAQs about Core files in case of fatal crash: https://rspamd.com/doc/faq.html#how-to-figure-out-why-rspamd-process-crashed
    * Tried ASAN package and obtained the ASAN report (if possible): https://rspamd.com/doc/faq.html#asan-builds 
    * Checked that your issue isn't already filed: https://github.com/issues?utf8=%E2%9C%93&q=is%3Aissue+user%3Arspamd
    * Checked that there is not already an experimental package or master branch

**Describe the bug**
Looking at DNS logs, I noticed rspamd sometimes sending DNS records for the default configured `fuzzy1.rspamd.com` & `fuzzy2.rspamd.com` servers causing returned NXDOMAINs:
```
22:39:51.436744 IP 127.0.0.1.49199 > 127.0.0.153.53: 52570+ [1au] A? fuzzy1.rspamd.com:11335. (52)
22:39:51.436762 IP 127.0.0.1.49199 > 127.0.0.153.53: 52826+ [1au] AAAA? fuzzy1.rspamd.com:11335. (52)
22:39:51.436889 IP 127.0.0.153.53 > 127.0.0.1.49199: 52570 NXDomain 0/1/1 (127)
22:39:51.436903 IP 127.0.0.153.53 > 127.0.0.1.49199: 52826 NXDomain 0/1/1 (127)
--
22:42:09.256720 IP 127.0.0.1.49199 > 127.0.0.153.53: 9819+ [1au] A? fuzzy2.rspamd.com:11335. (52)
22:42:09.256742 IP 127.0.0.1.49199 > 127.0.0.153.53: 10075+ [1au] AAAA? fuzzy2.rspamd.com:11335. (52)
22:42:09.256867 IP 127.0.0.153.53 > 127.0.0.1.49199: 9819 NXDomain 0/1/1 (127)
22:42:09.256878 IP 127.0.0.153.53 > 127.0.0.1.49199: 10075 NXDomain 0/1/1 (127)
```

I also have one additional fuzzy server configured where this happens aswell sometimes:
```
22:44:33.573673 IP 127.0.0.1.49199 > 127.0.0.153.53: 9067+ [1au] A? fuzzy.mailcow.email:11445. (54)
22:44:33.573694 IP 127.0.0.1.49199 > 127.0.0.153.53: 9323+ [1au] AAAA? fuzzy.mailcow.email:11445. (54)
22:44:33.573813 IP 127.0.0.153.53 > 127.0.0.1.49199: 9067 NXDomain 0/1/1 (129)
22:44:33.573825 IP 127.0.0.153.53 > 127.0.0.1.49199: 9323 NXDomain 0/1/1 (129)
```

This does not happen always, rspamd also makes DNS requests without any ports:
```
22:37:23.956034 IP 127.0.0.1.49199 > 127.0.0.153.53: 25946+ [1au] A? fuzzy.mailcow.email. (48)
22:37:23.956046 IP 127.0.0.1.49199 > 127.0.0.153.53: 26202+ [1au] AAAA? fuzzy.mailcow.email. (48)
22:37:23.956152 IP 127.0.0.153.53 > 127.0.0.1.49199: 25946$ 1/0/1 A 95.217.129.125 (64)
22:37:23.956161 IP 127.0.0.153.53 > 127.0.0.1.49199: 26202$ 0/1/1 (111)
22:37:23.956515 IP 127.0.0.1.49199 > 127.0.0.153.53: 26458+ [1au] A? fuzzy1.rspamd.com. (46)
22:37:23.956525 IP 127.0.0.1.49199 > 127.0.0.153.53: 26714+ [1au] AAAA? fuzzy1.rspamd.com. (46)
22:37:23.956562 IP 127.0.0.153.53 > 127.0.0.1.49199: 26458 1/0/1 A 135.181.136.158 (62)
22:37:23.956568 IP 127.0.0.153.53 > 127.0.0.1.49199: 26714 0/1/1 (118)
22:37:23.956666 IP 127.0.0.1.49199 > 127.0.0.153.53: 26970+ [1au] A? fuzzy2.rspamd.com. (46)
22:37:23.956688 IP 127.0.0.153.53 > 127.0.0.1.49199: 26970 1/0/1 A 135.181.136.158 (62)
22:37:23.956696 IP 127.0.0.1.49199 > 127.0.0.153.53: 27226+ [1au] AAAA? fuzzy2.rspamd.com. (46)
22:37:23.956717 IP 127.0.0.153.53 > 127.0.0.1.49199: 27226 0/1/1 (118)
```

The related configs would be:
```
fuzzy_check {
    retransmits = 1;
    rule {
        mailcow {
            symbol = "MAILCOW_FUZZY_UNKNOWN";
            mime_types [
                "application/*",
            ]
            encryption_key = "oa7xjgdr9u7w3hq1xbttas6brgau8qc17yi7ur5huaeq6paq8h4y";
            read_only = true;
            max_score = 100;
            fuzzy_map {
                MAILCOW_FUZZY_DENIED {
                    flag = 11;
                    max_score = 10;
                }
            }
            algorithm = "mumhash";
            servers = "fuzzy.mailcow.email:11445";
            skip_unknown = true;
        }
        rspamd.com {
            symbol = "FUZZY_UNKNOWN";
            mime_types [
                "*",
            ]
            min_length = 64;
            encryption_key = "icy63itbhhni8bq15ntp5n5symuixf73s1kpjh6skaq4e7nx5fiy";
            read_only = true;
            fuzzy_map {
                FUZZY_PROB {
                    flag = 2;
                    max_score = 10;
                }
                FUZZY_DENIED {
                    flag = 1;
                    max_score = 20;
                }
                FUZZY_WHITE {
                    flag = 3;
                    max_score = 2;
                }
            }
            max_score = 20;
            short_text_direct_hash = true;
            skip_unknown = true;
            algorithm = "mumhash";
            servers = "round-robin:fuzzy1.rspamd.com:11335,fuzzy2.rspamd.com:11335";
        }
    }
    timeout = 2;
    min_bytes = 1000;
}
```
```
    dns_max_requests = 64;
    dns {
        sockets = 16;
        enable_dnssec = false;
        timeout = 10;
        retransmits = 3;
    }
```

I am on version 3.1 on Arch Linux. I was not able to pinpoint the cause for this behavior for now and how to reproduce it.

**Comment by moisseev** [comment]
It has already been fixed with 3ea9cf43a9b034a3401ab84bd289ee783da0bfed, 7bf24f093da9151b8b8887fd40b64a51d1116437, d0321f0863e8d2d22177df38fea065ecf5dfe02e.
